,isbn,title,author,pub_year,publisher,categories,description,Category,Price,
625,380018179,The Thorn Birds,Colleen McCullough,1978,Avon,Fiction,"Now, 25 years after it first took the world by storm, Colleen McCullough's sweeping family saga of dreams, titanic struggles, dark passions, and forbidden love in the Australian Outback returns to enthrall a new generation. As powerful, moving, and unforgettable as when it originally appeared, it remains a monumental literary achievement—a landmark novel to be read . . . and read again!",Educational,276.43,
626,067101420X,"Forever... : A Novel of Good and Evil, Love and Hope",Jude Deveraux,2002,Pocket,Fiction,"From A Knight in Shining Armor to The Mulberry Tree, Jude Deveraux's bestsellers sparkle with stunning originality, heartfelt wit, and adventurous passion. Now, this superb storyteller mixes the flavor of a classic fairy tale with a very modern love story -- set in a town locked in the shadows of an abiding evil -- in this imaginative new novel. Forever... Darci Monroe overcame a childhood of neglect with an ebullient spirit, a positive attitude...and extraordinary determination. Now the resourceful young woman, hired as Adam Montgomery's personal assistant, devotes more than just professional attention to this devastatingly handsome millionaire. But one thing bars Adam from accepting Darci's love: he is intent on discovering the secret of his parents' disappearance, for she possesses the otherworldly abilities needed to help him fight a terrifying mistress of the dark arts. What Darci ends up offering is a gift greater than Adam ever hoped for, for Darci loves with all her heart, and all her soul, forever...",Spiritual,276.73,
627,679457313,The God of Small Things,Arundhati Roy,1997,Random House Inc,Fiction,"In 1969, in Kerala, India, Rahel and her twin brother, Estha, struggle to forge a childhood for themselves amid the destruction of their family life, as they discover that the entire world can be transformed in a single moment. A first novel. 35,000 first printing.","Entertainment,Educational",277.04,
628,394557433,Gift From The Sea,Anne Morrow Lindbergh,1986,Pantheon Books,,,"Entertainment,Spiritual",277.35,
629,553571656,The Beekeeper's Apprentice,LAURIE R. KING,1996,Bantam,Fiction,"A chance meeting with an elderly beekeeper turns into a pivotal, personal transformation when fifteen-year-old Mary Russell discovers that the beekeeper is the reclusive, retired master detective Sherlock Holmes, who soon takes on the role of mentor and teacher. Reissue.","Entertainment,Educational,Spiritual",277.66,
630,312169787,The Red Tent : A Novel,Anita Diamant,1997,St. Martin's Press,Fiction,"In a story based on the Book of Genesis, Jacob's only daughter, Dinah, shares her unique perspective on the origins of many of our modern religious practices and sexual politics, eager to impart the lessons in endurance and humanity she has learned from her father's wives. 45,000 first printing.","Educational,Spiritual",277.97,
631,786866276,Mother of Pearl,Melinda Haynes,1999,Hyperion,Fiction,"In a small Mississippi town during the late 1950s, Even Grade, a twenty-eight-year-old Black man who grew up as an orphan, and Valuable Korner, the teenage white daughter of the local prostitute, search for love, family, and commitment as their lives inte","Spiritual,Entertainment",278.28,
632,140266771,Larry's Party,Carol Shields,1998,Penguin Books,Fiction,A detailed study of the ordinary life of Larry Weller between 1977 and 1997 follows the floral designer as he deals with the rapidly changing world and two marriages and two divorces along the way. Reprint.,Entertainment,278.59,
633,015644450X,In Love &amp; Trouble: Stories of Black Women,Alice Walker,1974,Harvest Books,African American fiction,A collection of stories about African-American women living in the South and their struggles for dignity and love.,Educational,278.90,
634,679723420,Pale Fire: A Novel (Vintage International),Vladimir Vladimirovich Nabokov,1989,Vintage Books USA,Fiction,"Nabokov's parody, half poem and half commentary on the poem, deals with the escapades of the deposed king of Zemala in a New England college town",Spiritual,279.21,
635,441004016,The Anubis Gates,Tim Powers,1997,Ace Books,Fiction,A novel of time travel that combines action and adventure with the surreal and bizarre,"Entertainment,Educational",279.52,
636,140620338,Picture of Dorian Gray,Oscar Wilde,,Penguin Putnam~mass,,,"Entertainment,Spiritual",279.83,
637,3257061269,Der Alchimist.,Paulo Coelho,2003,"Diogenes Verlag, ZÃ?Â¼rich",Alchemists,"Ein Buch voller orientalischer Weisheit, eine Geschichte von wunderbarer Schlichtheit und kristalliner Klarheit, ein warmes, lebensfrohes Buch, das Mut macht, den eigenen Lebenstraum Wirklichkeit werden zu lassen.","Entertainment,Educational,Spiritual",280.14,
638,3453177622,Zeit im Wind.,Nicholas Sparks,2000,Heyne,,,"Educational,Spiritual",280.45,
639,3499108518,Der Fanger Im Roggen,Jerome D. Salinger,1966,Rowohlt Tb.,,,"Spiritual,Entertainment",280.76,
640,3518367064,Demian. Die Geschichte von Emil Sinclairs Jugend.,Hermann Hesse,1974,Suhrkamp,,,Entertainment,281.07,
641,3453088433,Das Druidentor.,Wolfgang Hohlbein,2002,Heyne,,,Educational,281.38,
642,553572490,Vice,Jane Feather,1996,Bantam,Fiction,"On the run since accidentally killing her elderly groom on their honeymoon, Juliana considers a shocking proposal by the handsome Duke of Redmayne in which she would pose as his mistress. Original.",Spiritual,281.69,
643,349103232,The crow road,Iain Banks,1993,Abacus,,,"Entertainment,Educational",282.00,
644,679745653,Breakfast at Tiffany's: And Three Stories (First Vintage International),Truman Capote,1993,Vintage Books USA,Fiction,"House of Flowers, A Diamond Guitar, and A Christmas Memory are included with the tale of a fun-loving amoral playgirl in New York City","Entertainment,Spiritual",282.31,
645,785268480,Rachel's Tears: The Spiritual Journey of Columbine Martyr Rachel Scott,Darrell Scott,2000,Nelson Books,Biography &amp; Autobiography,"Rachel Scott was a typical teenage girl who was incredibly dedicated to following and serving Christ. Though she was mocked for her beliefs, at times doubted her faith, and constantly struggled with personal issues every teenager faces, she remained faithful to God. Then on April 20, 1999, at Columbine High School, she was killed for that faith. Rachel's Tears is a moving meditation on the life, death, and faith of Rachel as seen through the eyes of her parents and through writings and drawings from her journals. Her parents also offer a spiritual perspective on the Columbine tragedy and provide a vision of hope for preventing youth violence across the nation.","Entertainment,Educational,Spiritual",282.62,
646,000649840X,Angelas Ashes,Frank Mccourt,,Harpercollins Uk,English fiction,For use in schools and libraries only. The author recounts his childhood in Depression-era Brooklyn as the child of Irish immigrants who decide to return to poverty in Ireland when his infant sister dies.,Entertainment,282.93,
647,140431268,Far from the Madding Crowd (Penguin Classics),Thomas Hardy,1989,Penguin Books,Astrology,"Set in his fictional Wessex countryside in southwest England, Far from the Madding Crowd was Thomas Hardy's breakthrough work. Though it was first published anonymously in 1874, the quick and tremendous success of Far from the Madding Crowd persuaded Hardy to give up his first profession, architecture, to concentrate on writing fiction. The story of the ill-fated passions of the beautiful Bathsheba Everdene and her three suitors offers a spectacle of country life brimming with an energy and charm not customarily associated with Hardy.",Educational,283.23,
648,99771519,Memoirs of a Geisha Uk,Arthur Golden,,Trafalgar Square,Geishas,"This story is a rare and utterly engaging experience. It tells the extraordinary story of a geisha -summoning up a quarter century from 1929 to the post-war years of Japan's dramatic history, and opening a window into a half-hidden world of eroticism and enchantment, exploitation and degradation. A young peasant girl is sold as servant and apprentice to a renowned geisha house. She tells her story many years later from the Waldorf Astoria in New York. Her memoirs conjure up the perfection and the ugliness of life behind rice-paper screens, where young girls learn the arts of geisha - dancing and singing, how to wind the kimono, how to walk and pour tea, and how to beguile the land's most powerful men.",Spiritual,283.54,
649,067102535X,"Last Dance, Last Chance (Ann Rule's Crime Files)",Ann Rule,2002,Pocket,,,"Entertainment,Educational",283.85,
650,876855575,Ham on Rye,Charles Bukowski,1982,Ecco,Fiction,"In what is widely hailed as the best of his many novels, Charles Bukowski details the long, lonely years of his own hardscrabble youth in the raw voice of alter ego Henry Chinaski. From a harrowingly cheerless childhood in Germany through acne-riddled high school years and his adolescent discoveries of alcohol, women, and the Los Angeles Public Library's collection of D. H. Lawrence, Ham on Rye offers a crude, brutal, and savagely funny portrait of an outcast's coming-of-age during the desperate days of the Great Depression.","Entertainment,Spiritual",284.16,
651,330376136,Once,James Herbert,2002,Pan,Fairies,"Partially incapacitated by a stroke, Thom Kincaid travels back to the wooded land where he grew up to recuperate. Surrounded by the comforts of Castle Bracken, Thom plans to relive old, forgotten memories. But his return stirs an ancient evil, one cloaked in the guise of a friend. His only chance for survival lies in a world in which he no longer believes.","Entertainment,Educational,Spiritual",284.47,
652,140272658,Are You Experienced?,William Sutcliffe,1998,Penguin Books Ltd,Fiction,"Liz travels to India because she wants to find herself. Dave travels to India because he wants to get Liz into bed. Liz loves India, hugs the beggars, and is well on the way to finding her tantric centre. Dave, however, realises he hates Liz, and has bad karma towards his fellow travellers: Jeremy, whose spiritual journey is aided by cheques from his dad in Tunbridge Wells; Jonah, who hasn't worn shoes for a decade; and Fee and Gaz, fresh from leper-washing in Udaipur . . .","Educational,Spiritual",284.78,
653,3442435838,Die PrÃ?Â¼fung.,F. Paul Wilson,1996,Goldmann,German fiction,"En studerende på det eksklusive lægevidenskabelige universitet Ingraham opdager, at der foregår regulær hjernevask og eksperimenter med mennesker som led i et komplot, der klassificerer patienterne samfundsmæssigt","Spiritual,Entertainment",285.09,
654,385720920,Choke,CHUCK PALAHNIUK,2002,Anchor,,,Entertainment,285.40,
655,385498721,Survivor : A Novel,CHUCK PALAHNIUK,2000,Anchor,,,Educational,285.71,
656,380813815,"Lamb : The Gospel According to Biff, Christ's Childhood Pal",Christopher Moore,2003,Perennial,Fiction,"The birth of Jesus has been well chronicled, as have his glorious teachings, acts, and divine sacrifice after his thirtieth birthday. But no one knows about the early life of the Son of God, the missing years -- except Biff, the Messiah's best bud, who has been resurrected to tell the story in the divinely hilarious yet heartfelt work ""reminiscent of Vonnegut and Douglas Adams"" (Philadelphia Inquirer). Verily, the story Biff has to tell is a miraculous one, filled with remarkable journeys, magic, healings, kung fu, corpse reanimations, demons, and hot babes. Even the considerable wiles and devotion of the Savior's pal may not be enough to divert Joshua from his tragic destiny. But there's no one who loves Josh more -- except maybe ""Maggie,"" Mary of Magdala -- and Biff isn't about to let his extraordinary pal suffer and ascend without a fight.",Spiritual,286.02,
657,836217632,The Curse of Madame C : A Far Side Collection,Gary Larson,1994,Andrews McMeel Publishing,Humor,"1994 FarWorks, Inc. All Rights Reserved. The Far Side and the Larson signature are registered trademarks of FarWorks, Inc.","Entertainment,Educational",286.33,
658,140099832,Lake Wobegon Days,Garrison Keillor,1990,Penguin/Puffin Mass Market (Mm),,,"Entertainment,Spiritual",286.64,
659,385314744,Rush Limbaugh Is a Big Fat Idiot: And Other Observations,Al Franken,1996,Delacorte Press,,,"Entertainment,Educational,Spiritual",286.95,
660,316107417,Happy Trails,Berke Breathed,1990,Little Brown &amp; Co,Humor,"This book contains selections from the author's comic strip, Bloom County.","Educational,Spiritual",287.26,
661,894803700,"14,000 Things to Be Happy About",Barbara Ann Kipfer,1990,Workman Publishing,Self-Help,"A listing of fourteen thousand things that people should be happy about--including flannel sheets, strawberry ice cream, Scrabble, red leotards, quiet libraries, patting the cat, and popsicle sticks","Spiritual,Entertainment",287.57,
662,590457225,Dealing With Dragons (Enchanted Forest Chronicles (Paperback)),Patricia C. Wrede,1992,Scholastic,Dragons,"For use in schools and libraries only. Determined not to be pushed into marrying a boring and proper prince, Princess Cimerone flees her kingdom and becomes an assistant to the dragon Kazul.",Entertainment,287.88,
663,316929190,All Too Human : A Political Education,George Stephanopoulos,1999,"Little, Brown",,,Educational,288.19,
664,140390693,Little Women (Penguin Classics),Louisa May Alcott,1989,Penguin Books,Juvenile Fiction,Chronicles the joys and sorrows of the four March sisters as they grow into young ladies in nineteenth-century New England,Spiritual,288.50,
665,439404371,The Thief Lord,Cornelia Funke,2002,Scholastic,,,"Entertainment,Educational",288.81,
666,679741011,"Sex, Art, and American Culture: Essays",Camille Paglia,1992,Vintage Books USA,Social Science,"The author shares her observations on date rape, sexual harassment, the decline of education and culture, and other key issues","Entertainment,Spiritual",289.12,
667,345307674,Return of the Jedi (Star Wars),James Kahn,1983,Del Rey Books,Fiction,Luke Skywalker leads the Rebel Alliance in a bold attempt to overcome the evil power of Darth Vader and the Empire,"Entertainment,Educational,Spiritual",289.43,
668,1573225789,The Color of Water: A Black Man's Tribute to His White Mother,James McBride,1997,Riverhead Books,Biography &amp; Autobiography,"An African American man describes life as the son of a white mother and Black father, reflecting on his mother's contributions to his life and his confusion over his own identity","Educational,Spiritual",289.73,
669,380754843,Wayside School is Falling Down,Louis Sachar,1990,HarperTrophy,,,"Spiritual,Entertainment",290.04,
670,345368940,The Dolphins of Pern,Anne McCaffrey,1994,Ballantine Books,,,Entertainment,290.35,
671,553296981,Anne Frank: The Diary of a Young Girl,ANNE FRANK,1993,Bantam,Biography &amp; Autobiography,A young girl's journal records her family's struggles during two years of hiding from the Nazis in war-torn Holland.,Educational,290.66,
672,375724575,The Family Orchard,Nomi Eve,2001,Vintage Books USA,,,Spiritual,290.97,
673,345285549,Elfstones of Shannara,Terry Brooks,1990,Del Rey Books,Fiction,"The grandson of Shea, Wil Ohmsford, searches for Amberle, the Chosen whose gift of Bloodfire is needed to create the Ellcrys tree that protects against demons. Reissue.","Entertainment,Educational",291.28,
674,345290240,Sword of Shannara,Terry Brooks,1980,Ballantine Books,,,"Entertainment,Spiritual",291.59,
675,345301870,"Ogre, Ogre",Piers Anthony,1982,Del Rey Books,,,"Entertainment,Educational,Spiritual",291.90,
676,451169530,The Stand: Complete and Uncut,Stephen King,1991,Signet Book,Fiction,The ultimate battle between good and evil...,"Educational,Spiritual",292.21,
677,067168390X,Lonesome Dove,Larry McMurtry,1988,Pocket,Fiction,"Set in the late-nineteenth century, this novel chronicles a cattle drive from Texas to Montana, and follows the lives of Gus and Call, the cowboys heading the drive, Gus's woman, Lorena, and Blue Duck, a sinister Indian renegade","Spiritual,Entertainment",292.52,
678,385335881,Shopaholic Takes Manhattan (Summer Display Opportunity),Sophie Kinsella,2002,Delta,Fiction,"TV financial guru Becky Bloomwood has finally paid off her debts and credit card bills, until her boyfriend, Luke, invites her to accompany him when he moves to New York, and she discovers sample sales, power lunches, and Fifth Avenue.",Entertainment,292.83,
679,385335482,Confessions of a Shopaholic (Summer Display Opportunity),SOPHIE KINSELLA,2001,Delta,Fiction,"Financial journalist Rebecca Bloomwood seeks solace from the boredom and pressures in life with her shopping, a solution that brings her close to financial disaster, until she encounters a story that will change her life.",Educational,293.14,
680,553258001,The Cider House Rules,John Irving,1986,Bantam Books,Fiction,"The practices of Dr. Wilbur Larch--obsetrician, orphanage director, ether addict, and abortionist--are hindered, abetted, and continued, in turn, by his favorite orphan, Homer Wells",Spiritual,293.45,
681,671679627,PRIME TIME : PRIME TIME,Judy Collins,1989,Pocket,,,"Entertainment,Educational",293.76,
682,373871279,Family At Last (Love Inspired (Numbered)),Carolyne Aarsen,2000,Steeple Hill,Fiction,"Immersed in the family law practice, consumed by long days and even longer nights, Matthew admired Cory's quiet faith and simple lifestyle. He prayed that God would now give him the strength to heal Cory's aching heart, and claim it at last...","Entertainment,Spiritual",294.07,
683,805063889,Nickel and Dimed: On (Not) Getting By in America,Barbara Ehrenreich,2001,Metropolitan Books,Business &amp; Economics,The sharp social critic and author of Blood Rites looks underneath the illusion of American prosperity at poverty and hopelessness in America.,"Entertainment,Educational,Spiritual",294.38,
684,068986020X,Gingerbread,Rachel Cohn,2003,Simon Pulse,Juvenile Fiction,"After being expelled from boarding school, Cyd Charisse's problems with her mother escalate after Cyd falls in love with a sensitive surfer and is sent from San Francisco to New York City to spend time with her biological father.",Entertainment,294.69,
685,553582658,Summer Light,Luanne Rice,2002,Bantam Books,Fiction,"Wedding planner May Taylor, who is raising her daughter Kylie, a gifted five year old who can see and hear things others cannot, no longer believes in the magic of true love until her daughter's visions lead her to notorious professional hockey player Martin Carter, a man haunted by loneliness, anger, and heartache. Reprint.",Educational,295.00,
686,051513399X,Smoke in Mirrors,Jayne Ann Krentz,2002,Jove Books,Fiction,"Unwittingly involved in a clever scheme devised by the late con artist and seductress Meredith Spooner, Leonora Hutton sets out to make things right and prove her innocence to Thomas Walker, another victim of Meredith's deceptions, but she gets more than she bargained for when she finds a safe-deposit box containing a book about Mirror House, the mansion where Meredith died, and newspaper clippings about an unsolved murder. Reprint.",Spiritual,295.31,
687,373218400,Table For Two,Nora Roberts,2002,Silhouette,Fiction,"Table For Two by Nora Roberts released on Oct 25, 2002 is available now for purchase.","Entertainment,Educational",295.62,
688,786867086,In Search of America,Tod Brewster,2002,Hyperion,History,"eter Jennings and Todd Brewster conceived of this fascinating book long before the events of September 11th. But watching America respond to one of the worst attacks in its history deepened the meaning of their project. Now, more than ever, Americans need to treasure their way of life, and to reacquaint themselves with the founding ideas that united and sustained this country in its struggle for independence two hundred and twenty-five years ago. In Search of America explores the basic ideals that drive and define the American character. Exquisitely designed, lavishly illustrated with photographs, and peppered with fascinating sidebars, this superb blend of eyewitness reporting and history is a significant, timely achievement. In Search of America is a splendid and provocative journey, one that will assure each and every American that though the principles of our great nation may be shaken, molded, adapted, and assaulted, remarkably, they endure.","Entertainment,Spiritual",295.92,
689,374216495,The Museum Guard,Howard Norman,1998,Farrar Straus Giroux,,,"Entertainment,Educational,Spiritual",296.23,
690,316825336,Evening News: A Novel,Marly A. Swick,1999,Little Brown &amp; Co,Fiction,"After nine-year-old Teddy accidentally shoots his two-year-old half-sister while playing with a gun, Teddy's stepfather finds himself unable to forgive him and even Teddy's mother begins to wonder why she cannot love her son unconditionally. 100,000 first printing.","Educational,Spiritual",296.54,
691,679419152,Nothin' but Good Times Ahead,Molly Ivins,1993,Random House Inc,Humor,"A follow-up to the best-selling Molly Ivins Can't Say That, Can She?, by the nationally syndicated columnist, pinpoints the 1992 campaign, fellow Texan Ross Perot, and Clinton's presidency. 100,000 first printing. $100,000 ad/promo. Tour.","Spiritual,Entertainment",296.85,
692,60192895,Hunting Badger,Tony Hillerman,1999,HarperCollins Publishers,Fiction,"Navajo crimebusters Leaphom and Chee are back together on a case, and at odds with the FBI over a backcountry manhunt in this latest thrilling addition to Tony Hillerman's best-selling series. In 1998 three heavily armed ""survivalists"" came out of the Four Corners canyons in a stolen truck. They murdered a policeman, had a shootout with pursuers, and then vanished -- eluding a manhunt that eventually involved hundreds of officers from more than twenty federal and state agencies. The crime and the bungled FBI investigation left behind a web of mysteries: Why did one of the bandits kill himself? How did the others escape? Why has no one in this impoverished area claimed the huge reward the government still offers? Most puzzling of all, what crime were they en route to commit when Officer Dale Claxton stopped them -- and paid for his bravery with his life? Tony Hillerman assigns these real puzzles to his fictional Navajo Tribal Police officers -- Sergeant Jim Chee and retired Lieutenant Joe Leaphorn. The time is now, and the memory of the mishandled manhunt of 1998 is still painfully fresh. Three men stage a predawn raid on the Ute tribe's gambling casino. They kill one policeman, wound another, and disappear in the maze of canyons on the Utah-Arizona border. The FBI takes over the investigation, and agents swarm in with their helicopters, their high-tech equipment, and a theory of the crime that makes a wounded deputy sheriff a suspect. This development calls Chee in from his vacation, and a request for a favor draws in Leaphorn. Chee finds a fatal flaw in the federal theory, and Leaphorn sees an intriguing pattern connecting this crime with the exploits of a legendary Ute hero-bandit. Tightly plotted and beautifully written, Hunting Badger proves once again that Tony Hillerman is a master storyteller.",Entertainment,297.16,
693,826308791,The Education of Little Tree (A Zia Book),Forrest Carter,1986,University of New Mexico Press,,,Educational,297.47,
694,140259198,The Island of the Day Before,Umberto Eco,1996,Penguin Books,Italian fiction,A panoramic historical novel set in the seventeenth century follows a young aristocrat who goes to sea to find love and an old Jesuit with a boundless scientific knowledge,Spiritual,297.78,
695,345435249,Darwin's Radio,Greg Bear,2000,Ballantine Books,Fiction,"A virus hunter at the Epidemic Intelligence Service has discovered that a long-dormant virus encoded in human DNA is about to re-awaken, with terrifying consequences for any woman about to have a child. Reprint.","Entertainment,Educational",298.09,
696,441003257,Good Omens,Neil Gaiman,1996,Ace Books,Fiction,"When the armies of Heaven and Hell decide it's time for Armageddon, a demon and an angel decide they like life on earth and team up to stop the coming apocalypse","Entertainment,Spiritual",298.40,
697,451202503,The Songcatcher: A Ballad Novel,Sharyn McCrumb,2002,Signet Book,Fiction,"Folksinger Lark McCourry retraces the history of a family song, which she had heard from her North Carolina relatives as a child, back to eighteenth-century Scotland to young Malcolm MacQuarry, kidnapped and sent to the American colonies, where he eventually became a lawyer and fought in the American Revolution. Reprint.","Entertainment,Educational,Spiritual",298.71,
698,446606812,Message in a Bottle,Nicholas Sparks,1999,Warner Vision,Fiction,"Now with a new look celebrating 20 years of Nicholas Sparks! Divorced and disillusioned about relationships, Theresa Osborne is jogging when she finds a bottle on the beach. Inside is a letter of love and longing to ""Catherine,"" signed simply ""Garrett."" Challenged by the mystery and pulled by emotions she doesn't fully understand, Theresa begins a search for this man that will change her life. What happens to her is unexpected, perhaps miraculous-an encounter that embraces all our hopes for finding someone special, for having a love that is timeless and everlasting.... Nicholas Sparks exquisitely chronicles the human heart. In his first bestselling novel, The Notebook, he created a testament to romantic love that touched readers around the world. Now in this New York Times bestseller, he renews our faith in destiny, in the ability of lovers to find each other no matter where, no matter when...","Educational,Spiritual",299.02,
