,isbn,title,author,pub_year,publisher,categories,description,Category,Price,
0,2005018,Clara Callan,Richard Bruce Wright,2001,HarperFlamingo Canada,Actresses,"In a small town in Canada, Clara Callan reluctantly takes leave of her sister, Nora, who is bound for New York. It's a time when the growing threat of fascism in Europe is a constant worry, and people escape from reality through radio and the movies. Meanwhile, the two sisters -- vastly different in personality, yet inextricably linked by a shared past -- try to find their places within the complex web of social expectations for young women in the 1930s. While Nora embarks on a glamorous career as a radio-soap opera star, Clara, a strong and independent-minded woman, struggles to observe the traditional boundaries of a small and tight-knit community without relinquishing her dreams of love, freedom, and adventure. However, things aren't as simple as they appear -- Nora's letters eventually reveal life in the big city is less exotic than it seems, and the tranquil solitude of Clara's life is shattered by a series of unforeseeable events. These twists of fate require all of Clara's courage and strength, and finally put the seemingly unbreakable bond between the sisters to the test.",Entertainment,20.00,
1,374157065,Flu: The Story of the Great Influenza Pandemic of 1918 and the Search for the Virus That Caused It,Gina Bari Kolata,1999,Farrar Straus Giroux,Medical,"Describes the great flu epidemic of 1918, an outbreak that killed some forty million people worldwide, and discusses the efforts of scientists and public health officials to understand and prevent another lethal pandemic",Educational,25.00,
2,399135782,The Kitchen God's Wife,Amy Tan,1991,Putnam Pub Group,Fiction,"A Chinese immigrant who is convinced she is dying threatens to celebrate the Chinese New Year by unburdening herself of everybody's hidden truths, thus prompting a series of comic misunderstandings",Spiritual,45.00,
3,440234743,The Testament,John Grisham,1999,Dell,Fiction,"A suicidal billionaire, a burnt-out Washington litigator, and a woman who has forsaken technology to work in the wilds of Brazil are all brought together by an astounding mystery of the testament","Entertainment,Educational",32.00,
4,452264464,Beloved (Plume Contemporary Fiction),Toni Morrison,1994,Plume,Fiction,"Staring unflinchingly into the abyss of slavery, this novel transforms history into a story as powerful as Exodus and as intimate as a lullaby. Sethe, its protagonist, was born a slave and escaped to Ohio, but eighteen years later she is still not free. She has too many memories of Sweet Home, the beautiful farm where so many hideous things happened. And Sethe's new home is haunted by the ghost of her baby, who died nameless and whose tombstone is engraved with a single word: Beloved.","Entertainment,Spiritual",43.00,
5,609804618,Our Dumb Century: The Onion Presents 100 Years of Headlines from America's Finest News Source,The Onion,1999,Three Rivers Press,Humor,"The staff of The Onion presents a satirical collection of mock headlines and news stories, including an account of the Pentagon's development of an A-bomb-resistant desk for schoolchildren","Entertainment,Educational,Spiritual",21.00,
6,1841721522,New Vegetarian: Bold and Beautiful Recipes for Every Occasion,Celia Brooks Brown,2001,Ryland Peters &amp; Small Ltd,Cooking,"In New Vegetarian Celia Brooks Brown presents an innovative approach to vegetarian cooking. There's practical advice on how to choose and prepare the major vegetarian ingredients, followed by 50 original, stylish recipes, all photographed by Philip Webb.","Educational,Spiritual",23.00,
7,971880107,Wild Animus,Rich Shapero,2004,Too Far,Fiction,"Wild animus is a search for the primordial, a test of human foundations and a journey to the breaking point.","Spiritual,Entertainment",45.00,
8,345402871,Airframe,Michael Crichton,1997,Ballantine Books,Fiction,"A fatal mid-air collision involving a commercial airliner prompts a frantic, desperate investigation into the causes of the accident, in a thriller exploring the issue of safety and security in the aircraft industry",Entertainment,37.32,
9,345417623,Timeline,MICHAEL CRICHTON,2000,Ballantine Books,Fiction,"Using a quantum time machine, a group of young historians is sent back to the year 1357 to rescue their trapped project leader.",Educational,38.56,
10,375759778,Prague : A Novel,ARTHUR PHILLIPS,2003,Random House Trade Paperbacks,Fiction,"Five American expatriates living in Budapest in the early 1990s seek to establish themselves and make their fortunes in a city still haunted by the tragedies of its Communist past. A first novel. Reader's Guide included. Reprint. 100,000 first printing.",Spiritual,39.80,
11,375406328,Lying Awake,Mark Salzman,2000,Alfred A. Knopf,Fiction,"Sister John of the Cross, an elderly nun, experiences a series of dazzling visions, but she is confronted with a difficult choice between her spiritual gifts and curing the powerful headaches that accompany her visions.","Entertainment,Educational",41.04,
12,446310786,To Kill a Mockingbird,Harper Lee,1988,Little Brown &amp; Company,Fiction,"The unforgettable novel of a childhood in a sleepy Southern town and the crisis of conscience that rocked it, To Kill A Mockingbird became both an instant bestseller and a critical success when it was first published in 1960. It went on to win the Pulitzer Prize in 1961 and was later made into an Academy Award-winning film, also a classic. Compassionate, dramatic, and deeply moving, To Kill A Mockingbird takes readers to the roots of human behavior - to innocence and experience, kindness and cruelty, love and hatred, humor and pathos. Now with over 18 million copies in print and translated into forty languages, this regional story by a young Alabama woman claims universal appeal. Harper Lee always considered her book to be a simple love story. Today it is regarded as a masterpiece of American literature.","Entertainment,Spiritual",42.27,
13,449005615,Seabiscuit: An American Legend,LAURA HILLENBRAND,2002,Ballantine Books,History,"The author retraces the amazing journey of Seabiscuit, a horse with crooked legs and a pathetic tail that nevertheless made racing history in 1938, thanks to the efforts of a trainer, an owner, and a jockey who transformed a bottom-level racehorse into a legend. Reader's Guide included. Reprint.","Entertainment,Educational,Spiritual",43.51,
14,60168013,Pigs in Heaven,Barbara Kingsolver,1993,Harpercollins,Fiction,"When Turtle witnesses a freak accident at the Hoover Dam, her mother responds and a man's life is saved, but their lives are changed by the incident. By the author of Animal Dreams. 100,000 first printing. $125,000 ad/promo. Tour.","Educational,Spiritual",44.75,
15,61099686,Downtown,Anne Rivers Siddons,1995,HarperTorch,Fiction,"The year is 1966, a time of innocence, possibility, and freedom. And for Atlanta, the country, and one woman making her way in a changing world, nothing will be the same . . . After an airless childhood in Savannah, Smoky O'Donnell arrives in Atlanta, dazzled and chastened by this hectic young city on the rise. Her new job as a writer with the city's Downtown magazine introduces her to many unforgettable people and propels her into the center of momentous events that will irrevocably alter her heart, her career, and her world.","Spiritual,Entertainment",45.99,
16,553582909,Icebound,Dean R. Koontz,2000,Bantam Books,Fiction,"A secret Arctic experiment turns into a frozen nightmare when a team of scientists, stranded on a drifting iceberg with a massive explosive charge, battles the elements for survival, only to discover that one of them is a murderer. Reissue.",Entertainment,47.23,
17,671888587,I'll Be Seeing You,Mary Higgins Clark,1994,Pocket,Fiction,A young news reporter on assignment at a large metropolitan hospital is horrified when she sees that a young Jane Doe whom paramedics have failed to save has a face identical to her own,Educational,48.46,
18,553582747,From the Corner of His Eye,Dean Koontz,2001,Bantam Books,Fiction,"Koontz looks heavenward for inspiration in his newest suspense thriller, which is chock-full of signs, portents, angels, and one somewhat second-rate devil, a murky and undercharacterized guy named Junior Cain who throws his beloved wife off a fire tower on an Oregon mountain and spends the rest of the novel waiting for the retribution that will surely come. But not before a series of tragedies ensues that convince Junior that someone or something named Bartholomew is out to exact vengeance for that crime and the series of other murders that follow. --- Amazon.",Spiritual,49.70,
19,425182908,Isle of Dogs,Patricia Cornwell,2002,Berkley Publishing Group,Fiction,"Angered over the governor's order on speed traps, the eccentric inhabitants of the Isle of Tangier, off the coast of Virginia, declare war on their own state, and it is up to Judy Hammer, the new superintendent of the state police, to stop the crisis.","Entertainment,Educational",50.94,
20,042518630X,Purity in Death,J.D. Robb,2002,Berkley Publishing Group,Fiction,Eve Dallas must face the impossible: someone has unleashed a computer virus that may be able to spread from machine to man.,"Entertainment,Spiritual",52.18,
21,440223571,This Year It Will Be Different: And Other Stories,Maeve Binchy,1997,Dell,Fiction,"Presents an anthology of Christmas stories reflecting on the various ways in which the holidays serve as a catalyst to promote change, growth, and new beginnings","Entertainment,Educational,Spiritual",53.42,
22,842342702,Left Behind: A Novel of the Earth's Last Days (Left Behind #1),Tim Lahaye,2000,Tyndale House Publishers,,,"Educational,Spiritual",54.65,
23,440225701,The Street Lawyer,JOHN GRISHAM,1999,Dell,Fiction,"After a violent encounter with a homeless man, talented corporate lawyer Michael finds himself out in the streets, lucky to be alive, and holding a top-secret file belonging to his former employers","Spiritual,Entertainment",55.89,
24,380715899,A Soldier of the Great War,Mark Helprin,1992,Avon Books,Fiction,"Encountering a younger man on a road in Italy, seventy-something professor Alessandro Guiliani recounts his experiences, spinning a tale of love, loss, tragedy, madmen, dwarves, and mafiosi. Reprint.",Entertainment,57.13,
25,671623249,LONESOME DOVE,Larry McMurtry,1986,Pocket,Fiction,"Presents a love story and an epic of the frontier, richly authentic that makes readers laugh, weep, dream and remember",Educational,58.37,
26,679810307,Shabanu: Daughter of the Wind (Border Trilogy),SUZANNE FISHER STAPLES,1991,Laurel Leaf,Juvenile Fiction,"Shabanu, a young nomad of the Cholistan Desert, must submit to the marriage her father arranges for her, or go against centuries of tradition by defying him.",Spiritual,59.61,
27,345260317,The Dragons of Eden: Speculations on the Evolution of Human Intelligence,Carl Sagan,1978,Ballantine Books,,,"Entertainment,Educational",60.85,
28,042511774X,Breathing Lessons,Anne Tyler,1994,Berkley Publishing Group,,,"Entertainment,Spiritual",62.08,
29,804106304,The Joy Luck Club,Amy Tan,1994,Prentice Hall (K-12),Fiction,"Encompassing two generations and a rich blend of Chinese and American history, the story of four struggling, strong women also reveals their daughters' memories and feelings","Entertainment,Educational,Spiritual",63.32,
30,1853262404,Heart of Darkness (Wordsworth Collection),Joseph Conrad,1998,NTC/Contemporary Publishing Company,Fiction,"Introduction and Notes by Gene M. Moore, Universiteit van Amsterdam. Generally regarded as the pre-eminent work of Conrad's shorter fiction, Heart of Darkness is a chilling tale of horror which, as the author intended, is capable of many interpretations. Set in the Congo during the period of rapid colonial expansion in the 19th century, the story deals with the highly disturbing effects of economic, social and political exploitation of European and African societies and the cataclysmic behaviour this induced in some individuals. The other two stories in this book - Youth and The End of the Tether - concern the sea and those who sail upon it, a genre in which Conrad reigns supreme.","Educational,Spiritual",64.56,
31,1853260053,Tess of the D'Urbervilles (Wordsworth Classics),Thomas Hardy,1997,NTC/Contemporary Publishing Company,Fiction,The story of a simple country girl whose family's pretentions lead to her destruction,"Spiritual,Entertainment",65.80,
32,60938412,The Accidental Virgin,Valerie Frankel,2003,Avon Trade,Fiction,"From: Venus, Goddess of Love, 120 Main, Mt. Olympus To: Stacy Temple, lapsed temptress Stacy, Stacy, Stacy. You were so promising at the beginning: Sexy, smart, personable and funny. Great on dates and really great afterward-if you know what I mean. But this is a sad state of affairs; or, in your case, non-affairs! It's been nearly an entire year and you haven't had your way with even ONE eligible male. You've been working so hard concocting sexy lingerie for Thongs.com -- and really, Stacy, if that little pink velvet bustier didn't put you in the mood, I don't know what to say! -- that you haven't even tried to be coaxed out of your own thong.com! Are you listening, Stacy? Seven days to find the perfect man -- or else! Happy hunting!",Entertainment,67.04,
33,140067477,The Tao of Pooh,Benjamin Hoff,1983,Penguin Books,Humor,"An expert in Chinese philosophy explains facets of Taoism using Milne's famous character and explores the world of Winnie-the-Pooh through Tao, characterizing Pooh as a simple bear who subscribes to the principles of successful living",Educational,68.27,
34,345465083,Seabiscuit,LAURA HILLENBRAND,2003,Ballantine Books,,,Spiritual,69.51,
35,1558531025,Life's Little Instruction Book (Life's Little Instruction Books (Paperback)),H. Jackson Brown,1991,Thomas Nelson,Conduct of life,,"Entertainment,Educational",70.75,
36,441783589,Starship Troopers,Robert A. Heinlein,1987,Ace Books,Fiction,In a futuristic military adventure a recruit goes through the roughest boot camp in the universe and into battle with the Terran Mobile Infantry in what historians would come to call the First Interstellar War,"Entertainment,Spiritual",71.99,
37,394895894,"The Ruby in the Smoke (Sally Lockhart Trilogy, Book 1)",PHILIP PULLMAN,1988,Laurel Leaf,Juvenile Fiction,"In nineteenth-century London, sixteen-year-old Sally, a recent orphan, becomes involved in a deadly search for a mysterious ruby.","Entertainment,Educational,Spiritual",73.23,
38,375410538,Anil's Ghost,MICHAEL ONDAATJE,2000,Knopf,Fiction,A forensic pathologist returns to Sri Lanka--after 15 years abroad--to assist in identifying victims of the country's civil war,Entertainment,74.46,
39,340767936,Turning Thirty,Mike Gayle,2000,Hodder &amp; Stoughton General Division,Age groups,"Unlike most people Matt Beckford is actually looking forward to turning thirty. After struggling through most of his twenties he thinks his career, finances and love life are finally sorted. But when he splits up with his girlfriend, he realises that life has different plans for him. Unable to cope with his future falling apart Matt temporarily moves back to his parents. During his enforced exodus only his old school mates can keep him sane. Friends he hasn't seen since he was nineteen. Back together after a decade apart. But things will never be the same for any of them because when you're turning thirty nothing's as simple as it used to be.",Educational,75.70,
40,316769487,The Catcher in the Rye,J.D. Salinger,1991,"Little, Brown",Fiction,"Anyone who has read J.D. Salinger's New Yorker stories, particularly A Perfect Day for Bananafish, Uncle Wiggily in Connecticut, The Laughing Man, and For Esme--With Love and Squalor, will not be surprised by the fact that his first novel is full of children. The hero-narrator of THE CATCHER IN THE RYE is an ancient child of sixteen, a native New Yorker named Holden Caulfield. Through circumstances that tend to preclude adult, secondhand description, he leaves his prep school in Pennsylvania and goes underground in New York City for three days. The boy himself is at once too simple and too complex for us to make any final comment about him or his story. Perhaps the safest thing we can say about Holden is that he was born in the world not just strongly attracted to beauty but, almost, hopelessly impaled on it. There are many voices in this novel: children's voices, adult voices, underground voices--but Holden's voice is the most eloquent of all. Transcending his own vernacular, yet remaining marvelously faithful to it, he issues a perfectly articulated cry of mixed pain and pleasure. However, like most lovers and clowns and poets of the higher orders, he keeps most of the pain to, and for, himself. The pleasure he gives away, or sets aside, with all his heart. It is there for the reader who can handle it to keep.",Spiritual,76.94,
41,8445071408,El Senor De Los Anillos: LA Comunidad Del Anillo (Lord of the Rings (Spanish)),J. R. R. Tolkien,2001,Minotauro,"Baggins, Frodo (Fictitious character)","En la adormecida e idílica Comarca, un joven hobbit recibe un encargo - custodiar el Anillo Único y emprender el viaje para su destrucción en las Grietas del Destino. Acompañado por magos, hombres, elfos y enanos, atravesará la Tierra Media y se internará en las sombras del País Oscuro, perseguido siempre por las huestes de Sauron, el Señor Oscuro, dispuesto a recuperar su creación para establecer el dominio definitivo del Mal.","Entertainment,Educational",78.18,
42,679429220,Midnight in the Garden of Good and Evil: A Savannah Story,John Berendt,1994,Random House,History,"In charming, beautiful, and wealthy old-South Savannah, Georgia, the local bad boy is shot dead inside of the opulent mansion of a gay antiques dealer, and a gripping trial follows","Entertainment,Spiritual",79.42,
43,671867156,Pretend You Don't See Her,Mary Higgins Clark,1998,Pocket,Fiction,"Placed in the federal witness protection program after seeing a murder, Manhattan real-estate agent Lacey Farrell nevertheless must solve the case before she becomes the next victim","Entertainment,Educational,Spiritual",80.65,
44,312252617,Fast Women,Jennifer Crusie,2001,St. Martin's Press,Fiction,"Following her divorce, Nell Dysart takes a job working for a detective agency and finds herself knee deep in embezzlement, bribery, blackmail, arson, adultery, murder, and passion with her boss, Gabe McKenna. 75,000 first printing.","Educational,Spiritual",81.89,
45,312261594,Female Intelligence,Jane Heller,2001,St. Martin's Press,,,"Spiritual,Entertainment",83.13,
46,316748641,Pasquale's Nose: Idle Days in an Italian Town,Michael Rips,2002,Back Bay Books,,,Entertainment,84.37,
47,446677450,"Rich Dad, Poor Dad: What the Rich Teach Their Kids About Money--That the Poor and Middle Class Do Not!",Robert T. Kiyosaki,2000,Warner Books,,,Educational,85.61,
48,451166892,The Pillars of the Earth,Ken Follett,1996,Signet Book,Fiction,"Set in twelfth-century England, this epic of kings and peasants juxtaposes the building of a magnificent church with the violence and treachery that often characterized the Middle Ages. Reissue.",Spiritual,86.85,
49,067976397X,Corelli's Mandolin : A Novel,LOUIS DE BERNIERES,1995,Vintage,Fiction,"The idyllic world of the Greek island of Cephallonia is forever changed by the inexorable changes of World War II, as the inhabitants struggle to cope with the Axis invasion and occupation","Entertainment,Educational",88.08,
50,786868716,The Five People You Meet in Heaven,Mitch Albom,2003,Hyperion,Fiction,"Plot Eddie is a wounded war veteran, an old man who has lived, in his mind, an uninspired life. His job is fixing rides at a seaside amusement park. On his 83rd birthday, a tragic accident kills him, as he tries to save a little girl from a falling cart. He awakes in the afterlife, where he learns that heaven is not a destination. It's a place where your life is explained to you by five people, some of whom you knew, others who may have been strangers. One by one, from childhood to soldier to old age, Eddie's five people revisit their connections to him on earth, illuminating the mysteries of his ""meaningless"" life, and revealing the haunting secret behind the eternal question: ""Why was I here"" Personal Details Collection Status In Collection Index 10 Read It Yes Links Amazon US Product Details LoC Classification PS3601.L335F59 2003 Dewey 813/.6","Entertainment,Spiritual",89.32,
51,671864769,Relics (Star Trek: The Next Generation),Michael Jan Friedman,1992,Star Trek,Fiction,"The starship Enterprise rescues Captain Montgomery Scott, who has been missing in space for seventy-five years and finds that the world has changed beyond his recognition","Entertainment,Educational,Spiritual",90.56,
52,312953453,Blood Oath,David Morrell,1994,St. Martin's Press,Fiction,"Peter Houston's journey to France to visit the grave of his father, killed in 1944, becomes a nightmare of murder, revenge, deception, and betrayal","Educational,Spiritual",91.80,
53,446608653,The Alibi,Sandra Brown,2000,Warner Books,Fiction,Assistant DA Hammond Cross has his sights set on the DA's office. Prosecuting a high-profile murder case practically ensures him the job. But a Saturday night encounter with a mysterious woman is the start of a living nightmare.,"Spiritual,Entertainment",93.04,
54,446612545,The Beach House,James Patterson,2003,Warner Books,Fiction,"When Jack Mullen sets out to unravel the truth about his brother's drowning death, he confronts legal interference as he discovers that his brother had been making money catering to the sexual needs of East Hampton's wealthiest citizens.",Entertainment,94.27,
55,446612618,A Kiss Remembered,Sandra Brown,2003,Warner Books,,,Educational,95.51,
56,451208080,The Short Forever,Stuart Woods,2003,Signet Book,Fiction,"Arriving in London to find a young woman, who has been seen in the company of an unsavory gentleman, for a client, Stone Barrington stumbles upon a deadly rivalry between two spies and is implicated in a horrifying double murder.",Spiritual,96.75,
57,553584383,Dead Aim,IRIS JOHANSEN,2004,Bantam Books,,,"Entertainment,Educational",97.99,
58,671027360,Angels &amp; Demons,Dan Brown,2001,Pocket Star,Fiction,"An ancient secret brotherhood. A devastating new weapon of destruction. An unthinkable target. ANGELS&amp;DEMONS World-renowned Harvard symbologist Robert Langdon is summoned to a Swiss cryptic symbol seared into the chest of a murdered physicist. What he discovers is unimaginable: a deadly vendetta against the Catholic Church by a centuries-old underground organization -- the Illuminati. Desperate to save the Vatican from a powerful the Vatican from a powerful time bomb, Langdon joins forces in Rome with the beautiful and mysterious scientist Vittoria Vetra. Together they embark on a frantic hunt through sealed crypts, dangerous catacombs, deserted cathedrals, and the most secretive long-forgotten Illuminati lair. DEMONS.","Entertainment,Spiritual",99.23,
59,316735736,All He Ever Wanted: A Novel,Anita Shreve,2004,Back Bay Books,Fiction,"""A marriage is always two intersecting stories."" This realization comes perhaps too late to the husband of Etna Bliss-a man whose obsession with his young wife begins at the moment of their first meeting, as he helps Etna and her companions escape from a fire in a hotel restaurant, and culminates in a marriage doomed by secrets and betrayal. Written with the intelligence and grace that are the hallmarks of Anita Shreve's bestselling novels, this gripping tale of desire, jealousy, and loss is peopled by unforgettable characters as real as the emotions that bring them together.","Entertainment,Educational,Spiritual",100.46,
60,743439740,"Every Breath You Take : A True Story of Obsession, Revenge, and Murder",Ann Rule,2002,Pocket,,,"Educational,Spiritual",101.70,
61,380619458,The Mosquito Coast,Paul Theroux,1990,Harper Mass Market Paperbacks (Mm),Americans,An eccentric American inventor moves his family to the jungles of Central America in hopes of finding a better life,"Spiritual,Entertainment",102.94,
62,671042858,The Girl Who Loved Tom Gordon,Stephen King,2000,Pocket,Fiction,"The acclaimed #1 New York Times and undisputed King of Horror Stephen King offers a frightening suspense novel about a young girl who becomes lost in the woods as night falls. On a six-mile hike on the Maine-New Hampshire branch of the Appalachian Trail, nine-year-old Trisha McFarland quickly tires of the constant bickering between her older brother, Pete, and her recently divorced mother. But when she wanders off by herself, and then tries to catch up by attempting a shortcut, she becomes lost in a wilderness maze full of peril and terror. As night falls, Trisha has only her ingenuity as a defense against the elements, and only her courage and faith to withstand her mounting fears. For solace she tunes her Walkman to broadcasts of Boston Red Sox baseball games and follows the gritty performances of her hero, relief pitcher Tom Gordon. And when her radio’s reception begins to fade, Trisha imagines that Tom Gordon is with her—protecting her from an all-too-real enemy who has left a trail of slaughtered animals and mangled trees in the dense, dark woods…",Entertainment,104.18,
63,743249992,Bringing Down the House: The Inside Story of Six M.I.T. Students Who Took Vegas for Millions,Ben Mezrich,2003,Free Press,Biography &amp; Autobiography,"Recounts the story of how a notorious gang of MIT blackjack savants devised and received backing for a system for winning at the world's most sophisticated casinos, an endeavor that earned them more than three million dollars. Reprint. 100,000 first printing.",Educational,105.42,
